{
  "caveats": [
    "`final_response` is optional and may be `null` when the turn completes without a final-answer style assistant message.",
    "The lower-level `thread.turn(...)` path still matters for streaming, steering, interrupting, and direct access to the raw `Turn` object."
  ],
  "confidence": "confirmed",
  "config_flags": [],
  "expected_effect": "The call should return a `RunResult` object with the collected thread items, optional token usage, and a `final_response` string when the turn produces a final-answer or phase-less assistant message.",
  "how_to_try": "In a Codex build that includes PR #15088, start a Python SDK thread with `codex.thread_start(...)` and call `thread.run(\"Say hello in one sentence.\")` or `await thread.run(\"Say hello in one sentence.\")` in the async API.",
  "impact": "low",
  "kind": "capability",
  "lane": "github",
  "proof_points": [
    "The PR title and body explicitly frame this as new Python SDK convenience methods: `thread.run(...)` and `async thread.run(...)` for the common case.",
    "The code adds new `_inputs.py` and `_run.py` helpers, including `RunInput` and a `RunResult` dataclass with `final_response`, collected `items`, and optional `usage`.",
    "The README, getting-started guide, quickstart examples, and runtime/signature tests were updated to use `thread.run(...)`, which shows the new flow is intended for public use rather than internal refactoring."
  ],
  "published_at": "2026-03-19T00:57:48Z",
  "schema": "signal_entry/v1",
  "slug": "python-sdk-thread-run-convenience-methods",
  "source_refs": {
    "commit_urls": [
      "https://github.com/openai/codex/commit/35361493510c75d82bfb2ee6921d923a30527091",
      "https://github.com/openai/codex/commit/33289a1dd3e6bfbc5c15ab1bdf64b8c6db024253",
      "https://github.com/openai/codex/commit/8c521cb74df0838781f4c9a17141d939a7643b6d",
      "https://github.com/openai/codex/commit/5f141adc0dcec3af0e33e9c65f5d0305139ecc99",
      "https://github.com/openai/codex/commit/c547a4334d71b41934a3b9d2b8475a38dced0e7b",
      "https://github.com/openai/codex/commit/62ff8ba5d40d89d838e6f991d37ac5f0b2e74db7",
      "https://github.com/openai/codex/commit/5bec0bb5f9e0dcb6953e8188317e89ec13a991fc",
      "https://github.com/openai/codex/commit/93f5ebe275a20be612169d6680547f7e395b26d2",
      "https://github.com/openai/codex/commit/4c52a5dd47de08bc731d79ae82b1c9146a5bc7fc",
      "https://github.com/openai/codex/commit/49ff2823022f7ed7c99f0f16db25446089993611",
      "https://github.com/openai/codex/commit/a32b804c29b864c635e76356f4bd041a58acd587",
      "https://github.com/openai/codex/commit/7f5e539e1a2cb14d3f343a18fd8bbd603c1a12dd"
    ],
    "items": [
      {
        "kind": "pull_request",
        "meta": "#15088",
        "title": "Add Python SDK thread.run convenience methods",
        "url": "https://github.com/openai/codex/pull/15088"
      },
      {
        "kind": "commit",
        "meta": "3536149",
        "title": "python-sdk: add thread.run convenience methods",
        "url": "https://github.com/openai/codex/commit/35361493510c75d82bfb2ee6921d923a30527091"
      },
      {
        "kind": "commit",
        "meta": "33289a1",
        "title": "python-sdk: update quickstart examples for thread.run",
        "url": "https://github.com/openai/codex/commit/33289a1dd3e6bfbc5c15ab1bdf64b8c6db024253"
      },
      {
        "kind": "commit",
        "meta": "5f141ad",
        "title": "python-sdk: fix thread.run final response semantics",
        "url": "https://github.com/openai/codex/commit/5f141adc0dcec3af0e33e9c65f5d0305139ecc99"
      },
      {
        "kind": "commit",
        "meta": "62ff8ba",
        "title": "python-sdk: use typed thread items for run results",
        "url": "https://github.com/openai/codex/commit/62ff8ba5d40d89d838e6f991d37ac5f0b2e74db7"
      },
      {
        "kind": "commit",
        "meta": "93f5ebe",
        "title": "Merge remote-tracking branch 'origin/main' into dev/shaqayeq/python-sdk-thread-run",
        "url": "https://github.com/openai/codex/commit/93f5ebe275a20be612169d6680547f7e395b26d2"
      },
      {
        "kind": "commit",
        "meta": "4c52a5d",
        "title": "python-sdk: prefer final-answer phase in run results",
        "url": "https://github.com/openai/codex/commit/4c52a5dd47de08bc731d79ae82b1c9146a5bc7fc"
      },
      {
        "kind": "commit",
        "meta": "49ff282",
        "title": "python-sdk: split convenience helpers out of api",
        "url": "https://github.com/openai/codex/commit/49ff2823022f7ed7c99f0f16db25446089993611"
      },
      {
        "kind": "commit",
        "meta": "a32b804",
        "title": "python-sdk: inline turn handles into api facade",
        "url": "https://github.com/openai/codex/commit/a32b804c29b864c635e76356f4bd041a58acd587"
      },
      {
        "kind": "commit",
        "meta": "7f5e539",
        "title": "python-sdk: make run final_response optional",
        "url": "https://github.com/openai/codex/commit/7f5e539e1a2cb14d3f343a18fd8bbd603c1a12dd"
      }
    ],
    "pr_url": "https://github.com/openai/codex/pull/15088",
    "repo": "openai/codex"
  },
  "summary": "Merged PR #15088 adds `thread.run(...)` and `async thread.run(...)` to the Python SDK, giving users a simpler path for common prompt-response flows without manually creating and running a turn handle.",
  "title": "Python SDK adds `thread.run()` convenience methods for one-shot turns",
  "why_it_matters": "This lowers the amount of SDK code needed for basic request-response usage. Python users can now send a string or input bundle directly from a thread and get a compact result object back, while the lower-level turn API remains available for streaming and more advanced control."
}
