{
  "caveats": [
    "This is specific to hardened macOS release binaries; it does not imply a broader cross-platform behavior change."
  ],
  "confidence": "confirmed",
  "config_flags": [],
  "impact": "low",
  "kind": "behavior_change",
  "lane": "github",
  "proof_points": [
    "The PR body says hardened macOS release binaries failed to allocate executable memory for JIT-compiled JS without this entitlement, and reports that the same exec path succeeds once the entitlement is added.",
    "The signing action in `.github/actions/macos-code-sign/action.yml` now passes `--entitlements` to `codesign` for the `codex` and `codex-responses-api-proxy` binaries.",
    "The new `.github/actions/macos-code-sign/codex.entitlements.plist` enables Apple's `com.apple.security.cs.allow-jit` entitlement, which is the concrete behavior change introduced by the PR."
  ],
  "published_at": "2026-03-21T20:43:15Z",
  "schema": "signal_entry/v1",
  "slug": "signed-macos-codex-binaries-now-include-the-jit-entitlement",
  "source_refs": {
    "commit_urls": [
      "https://github.com/openai/codex/commit/7ea53cad295e936bbd5288d76f56ba7700857b40"
    ],
    "items": [
      {
        "kind": "pull_request",
        "meta": "#15409",
        "title": "Add JIT entitlement for macosx",
        "url": "https://github.com/openai/codex/pull/15409"
      },
      {
        "kind": "commit",
        "meta": "7ea53ca",
        "title": "Add JIT entitlement for macosx",
        "url": "https://github.com/openai/codex/commit/7ea53cad295e936bbd5288d76f56ba7700857b40"
      }
    ],
    "pr_url": "https://github.com/openai/codex/pull/15409",
    "repo": "openai/codex"
  },
  "summary": "PR #15409 updates the macOS signing flow so hardened release binaries can allocate executable memory for JIT-compiled JavaScript instead of crashing during `codex exec` runs.",
  "title": "Signed macOS Codex binaries now include the JIT entitlement",
  "why_it_matters": "This fixes a platform-specific failure in shipped macOS builds. If you use a signed or notarized Codex binary on macOS, exec flows that rely on JIT-compiled JS should work where they previously died with a low-level CodeRange memory error."
}
