{
  "confidence": "likely",
  "config_flags": [],
  "impact": "low",
  "kind": "behavior_change",
  "lane": "github",
  "proof_points": [
    "The PR body says the new agent-graph representation is now used for both cascading agent close and cascading resume.",
    "The bundle adds a new `thread_spawn_edges` table plus `DirectionalThreadSpawnEdgeStatus` (`Open` and `Closed`), which shows parent-child agent relationships are now persisted as first-class state.",
    "The `close_agent` tool path switches to `agent_control.close_agent(...)`, and the tool description was updated to say it closes an agent \"and any open descendants,\" making descendant shutdown part of the user-visible contract.",
    "`agent/control.rs` and `control_tests.rs` add graph-aware lifecycle and resume coverage, which supports the PR's claim that subtree resume now uses the persisted agent network."
  ],
  "published_at": "2026-03-19T10:21:26Z",
  "schema": "signal_entry/v1",
  "slug": "agent-trees-now-cascade-close-and-resume",
  "source_refs": {
    "commit_urls": [
      "https://github.com/openai/codex/commit/e24a0f8c4f6c0f66992b2c354c57036e55b30619",
      "https://github.com/openai/codex/commit/90c350a49a50d28a32681e64b0dcf46caaea4e3e",
      "https://github.com/openai/codex/commit/c3b9f1b72c18058ed9f3d9220f68f476bedd537f"
    ],
    "items": [
      {
        "kind": "pull_request",
        "meta": "#15056",
        "title": "feat: add graph representation of agent network",
        "url": "https://github.com/openai/codex/pull/15056"
      },
      {
        "kind": "commit",
        "meta": "e24a0f8",
        "title": "feat: add graph representation of agent network",
        "url": "https://github.com/openai/codex/commit/e24a0f8c4f6c0f66992b2c354c57036e55b30619"
      },
      {
        "kind": "commit",
        "meta": "90c350a",
        "title": "fix bazel",
        "url": "https://github.com/openai/codex/commit/90c350a49a50d28a32681e64b0dcf46caaea4e3e"
      },
      {
        "kind": "commit",
        "meta": "c3b9f1b",
        "title": "nit",
        "url": "https://github.com/openai/codex/commit/c3b9f1b72c18058ed9f3d9220f68f476bedd537f"
      }
    ],
    "pr_url": "https://github.com/openai/codex/pull/15056",
    "repo": "openai/codex"
  },
  "summary": "Merged PR #15056 adds persisted parent-child agent graph state so close and resume flows can apply to descendant agents instead of treating each agent as an isolated thread.",
  "title": "Agent trees now cascade close and resume",
  "why_it_matters": "Users working with nested agents are less likely to leave orphaned child agents behind when closing a parent, and resumed sessions can restore the same subtree structure instead of losing those relationships."
}
