{
  "caveats": [
    "Most of the change is structural and test/implementation cleanup around existing exec-server behavior, not a large outward feature addition.",
    "Remote behavior is now explicit in codepaths, which is an internal architecture change that may still need operational validation in real remote deployments."
  ],
  "confidence": "confirmed",
  "config_flags": [],
  "impact": "low",
  "kind": "capability",
  "lane": "github",
  "proof_points": [
    "PR narrative states the change pattern per feature: trait on environment, local implementation, remote implementation via network proxy, and handler integration for PRC requests.",
    "`codex-rs/exec-server/src/file_system.rs` introduces the shared `ExecutorFileSystem` interface and supporting option/type definitions.",
    "`codex-rs/exec-server/src/environment.rs` switches `get_filesystem` to return `RemoteFileSystem` when a remote client exists, otherwise `LocalFileSystem`.",
    "`codex-rs/exec-server/src/remote_file_system.rs` adds a new remote implementation that fulfills the shared trait with protocol-level filesystem operations.",
    "`codex-rs/exec-server/tests/file_system.rs` adds a large parameterized test module covering filesystem operations for both local and remote file systems.",
    "`codex-rs/exec-server/src/server/file_system_handler.rs` and `codex-rs/exec-server/src/server/handler.rs` are updated to use the new module split and handler naming.",
    "`codex-rs/exec-server/src/server/transport.rs` adds websocket URL output support used by the test harness (`exec_server.rs`)."
  ],
  "published_at": "2026-03-20T00:08:04Z",
  "schema": "signal_entry/v1",
  "slug": "openai-codex-pr-15232",
  "source_refs": {
    "commit_urls": [
      "https://github.com/openai/codex/commit/4b42ea880de8db20694905bb2057b711f4eaf9b7",
      "https://github.com/openai/codex/commit/ec76d77fe343f95433bcc9d2458fa1ea61266c19",
      "https://github.com/openai/codex/commit/7dc075970b435ca4b3269db46e5e0aafd2d12fc9",
      "https://github.com/openai/codex/commit/4a9479b983cd5de31690ab34621182e00de1b045",
      "https://github.com/openai/codex/commit/4b303df05795a90402c8b9ee08e719cf81b1f659"
    ],
    "items": [
      {
        "kind": "pull_request",
        "meta": "#15232",
        "title": "Refactor ExecServer filesystem split between local and remote",
        "url": "https://github.com/openai/codex/pull/15232"
      },
      {
        "kind": "commit",
        "meta": "4b42ea8",
        "title": "Extract local and remote fs APIs",
        "url": "https://github.com/openai/codex/commit/4b42ea880de8db20694905bb2057b711f4eaf9b7"
      },
      {
        "kind": "commit",
        "meta": "ec76d77",
        "title": "Add parameterized file system tests",
        "url": "https://github.com/openai/codex/commit/ec76d77fe343f95433bcc9d2458fa1ea61266c19"
      },
      {
        "kind": "commit",
        "meta": "7dc0759",
        "title": "Merge remote-tracking branch 'origin/main' into pakrym/compare-execserverfilesystem-and",
        "url": "https://github.com/openai/codex/commit/7dc075970b435ca4b3269db46e5e0aafd2d12fc9"
      },
      {
        "kind": "commit",
        "meta": "4a9479b",
        "title": "Print exec server websocket URL",
        "url": "https://github.com/openai/codex/commit/4a9479b983cd5de31690ab34621182e00de1b045"
      },
      {
        "kind": "commit",
        "meta": "4b303df",
        "title": "exec-server: remove expect usage in filesystem tests",
        "url": "https://github.com/openai/codex/commit/4b303df05795a90402c8b9ee08e719cf81b1f659"
      }
    ],
    "pr_url": "https://github.com/openai/codex/pull/15232",
    "repo": "openai/codex"
  },
  "summary": "The PR refactors filesystem handling in codex-exec-server behind a shared trait with separate local and remote implementations, and routes execution environment selection through that abstraction.",
  "title": "Split ExecServer filesystem into local and remote backends",
  "why_it_matters": "This reduces coupling between local and remote execution paths, making remote file operations a first-class implementation path rather than ad-hoc logic and improving confidence the same filesystem behavior is available in both modes. It also sets up safer future changes by isolating responsibilities and extending test coverage to both backends."
}
