{
  "confidence": "confirmed",
  "config_flags": [],
  "impact": "low",
  "kind": "behavior_change",
  "lane": "github",
  "proof_points": [
    "The PR body states three user-visible objectives: use requirement-resolved `config.features` as the plugin gate, guard plugin list/read flows behind that gate, and skip bad `marketplace.json` files instead of failing the entire list.",
    "`codex-rs/core/src/plugins/marketplace.rs` now wraps marketplace loading in a match that warns and continues on failure, and adds a test for skipping failing marketplaces.",
    "`codex-rs/app-server/src/codex_message_processor.rs` changes plugin request handling to load latest config (`load_latest_config`) before continuing and treats plugin-disabled as a distinct case instead of treating marketplace/config issues as a hard plugin failure.",
    "`codex-rs/core/src/skills/manager.rs` and call sites in `codex-rs/core/src/codex.rs`, `codex-rs/core/src/codex_tests.rs`, and `codex-rs/core/src/tools/runtimes/shell/unix_escalation.rs` now pass config into `skills_for_cwd`, making behavior follow the active config state."
  ],
  "published_at": "2026-03-19T00:03:37Z",
  "schema": "signal_entry/v1",
  "slug": "openai-codex-pr-15104",
  "source_refs": {
    "commit_urls": [
      "https://github.com/openai/codex/commit/62b5fbceec22f9530a389ba2eb2ede9902535ae7",
      "https://github.com/openai/codex/commit/fdd9ab96a5b82385042dc98a3419d3ab4a0331c8",
      "https://github.com/openai/codex/commit/2f834baff6670f65bc8fd8d1f37d01f89478d698",
      "https://github.com/openai/codex/commit/801f8345b86a0ddf10afb9b3b8c3c2dd3752a660",
      "https://github.com/openai/codex/commit/fdb355c92326f9954a4db16f2bdfc88b59f87414"
    ],
    "items": [
      {
        "kind": "pull_request",
        "meta": "#15104",
        "title": "fix: harden plugin feature gating",
        "url": "https://github.com/openai/codex/pull/15104"
      },
      {
        "kind": "commit",
        "meta": "62b5fbc",
        "title": "fix: read plugin feature flag from requirement-resolved config.",
        "url": "https://github.com/openai/codex/commit/62b5fbceec22f9530a389ba2eb2ede9902535ae7"
      },
      {
        "kind": "commit",
        "meta": "fdd9ab9",
        "title": "guard plugin/*** with the feature flag.",
        "url": "https://github.com/openai/codex/commit/fdd9ab96a5b82385042dc98a3419d3ab4a0331c8"
      },
      {
        "kind": "commit",
        "meta": "2f834ba",
        "title": "Fail open to marketplace.json fail.",
        "url": "https://github.com/openai/codex/commit/2f834baff6670f65bc8fd8d1f37d01f89478d698"
      },
      {
        "kind": "commit",
        "meta": "801f834",
        "title": "Cleanup configured_plugin_states",
        "url": "https://github.com/openai/codex/commit/801f8345b86a0ddf10afb9b3b8c3c2dd3752a660"
      }
    ],
    "pr_url": "https://github.com/openai/codex/pull/15104",
    "repo": "openai/codex"
  },
  "summary": "PR #15104 updates plugin-related flows to use requirement-resolved config for the plugin feature gate, passes config-aware context through skill loading, and makes marketplace discovery tolerate malformed files instead of failing hard.",
  "title": "Harden plugin listing/read behavior with resolved feature gating",
  "why_it_matters": "This change makes plugin commands more reliable for users by preventing a single broken marketplace file from breaking plugin list/read operations, while ensuring plugin enablement is consistently driven by resolved configuration."
}
