{
  "caveats": [
    "The bundle shows test and snapshot additions only, and the PR body explicitly says runtime logic is unchanged.",
    "The main `codex_tests.rs` patch excerpt is truncated in the bundle, so the helper implementation details are only partially visible."
  ],
  "confidence": "confirmed",
  "config_flags": [],
  "impact": "low",
  "kind": "behavior_change",
  "lane": "github",
  "proof_points": [
    "The PR body explicitly says it adds a snapshot-style core test for fork startup context injection followed by first-turn diff injection, and that it captures current behavior without changing runtime logic.",
    "The bundle changes only `codex-rs/core/src/codex_tests.rs` plus a new snapshot file, and the main test file's patch excerpt adds test-only imports such as `context_snapshot`, `CollaborationMode`, `ModeKind`, `Settings`, and `AskForApproval`.",
    "The new snapshot records the first forked request sequence with duplicated `PERMISSIONS_INSTRUCTIONS` and `ENVIRONMENT_CONTEXT` entries before a fork-turn `collaboration_mode` instruction, confirming the exact behavior this PR locks down.",
    "The commit series stays focused on narrowing, stabilizing, and snippetizing the fork snapshot fixture, which reinforces that this PR is about test coverage and behavior capture rather than a runtime feature rollout."
  ],
  "published_at": "2026-03-23T01:24:14Z",
  "schema": "signal_entry/v1",
  "slug": "forked-session-startup-context-ordering-is-now-pinned-by-a-snapshot-test",
  "source_refs": {
    "commit_urls": [
      "https://github.com/openai/codex/commit/e3e3f29032d2b6723419ebf3edde4ea95eb5ede1",
      "https://github.com/openai/codex/commit/c42549daab6b5791c75f47b2c2d8c9b7d03e6044",
      "https://github.com/openai/codex/commit/20bb56962893c17d4e1196a2207f822641677de9",
      "https://github.com/openai/codex/commit/bea065b40de0cce4711f20ab45ec0bdf4c885e0a",
      "https://github.com/openai/codex/commit/7464ec0906c0fcf80cfff8465d3e9559b370c370",
      "https://github.com/openai/codex/commit/b3f203b3ff2a61b9756488feb6f97a858e3521d1",
      "https://github.com/openai/codex/commit/f07987854316a2f9370f125fe61dee955b08433d",
      "https://github.com/openai/codex/commit/97288e360aa532c50d2a7e991ad7aae8f5cdf63e"
    ],
    "items": [
      {
        "kind": "pull_request",
        "meta": "#15443",
        "title": "core: snapshot fork startup context injection",
        "url": "https://github.com/openai/codex/pull/15443"
      },
      {
        "kind": "commit",
        "meta": "e3e3f29",
        "title": "core: snapshot fork startup context injection",
        "url": "https://github.com/openai/codex/commit/e3e3f29032d2b6723419ebf3edde4ea95eb5ede1"
      },
      {
        "kind": "commit",
        "meta": "c42549d",
        "title": "core: narrow fork snapshot fixture",
        "url": "https://github.com/openai/codex/commit/c42549daab6b5791c75f47b2c2d8c9b7d03e6044"
      },
      {
        "kind": "commit",
        "meta": "20bb569",
        "title": "core: fix fork snapshot helper borrow",
        "url": "https://github.com/openai/codex/commit/20bb56962893c17d4e1196a2207f822641677de9"
      },
      {
        "kind": "commit",
        "meta": "bea065b",
        "title": "core: snapshot full first forked request",
        "url": "https://github.com/openai/codex/commit/bea065b40de0cce4711f20ab45ec0bdf4c885e0a"
      },
      {
        "kind": "commit",
        "meta": "7464ec0",
        "title": "core: stabilize fork snapshot across platforms",
        "url": "https://github.com/openai/codex/commit/7464ec0906c0fcf80cfff8465d3e9559b370c370"
      },
      {
        "kind": "commit",
        "meta": "b3f203b",
        "title": "core: snippetize fork snapshot request text",
        "url": "https://github.com/openai/codex/commit/b3f203b3ff2a61b9756488feb6f97a858e3521d1"
      },
      {
        "kind": "commit",
        "meta": "f079878",
        "title": "core: drop redundant fork snapshot normalization",
        "url": "https://github.com/openai/codex/commit/f07987854316a2f9370f125fe61dee955b08433d"
      },
      {
        "kind": "commit",
        "meta": "97288e3",
        "title": "core: remove unused fork snapshot mock binding",
        "url": "https://github.com/openai/codex/commit/97288e360aa532c50d2a7e991ad7aae8f5cdf63e"
      }
    ],
    "pr_url": "https://github.com/openai/codex/pull/15443",
    "repo": "openai/codex"
  },
  "summary": "Merged PR #15443 adds a core snapshot test that captures the current first request after a fork, including startup-context replay and first-turn collaboration-mode injection, without changing runtime logic.",
  "title": "Forked-session startup context ordering is now pinned by a snapshot test",
  "watch_state": "Watch for follow-up fork-runtime PRs that intentionally deduplicate or reorder startup context injection, since this change mainly freezes today's behavior for regression detection.",
  "why_it_matters": "This is mainly a reliability signal rather than a new feature. Forked-session prompt assembly affects approval and planning flows, and the new snapshot makes future regressions in that ordering easier to catch before they leak into user-visible fork behavior."
}
