{
  "caveats": [
    "The bundle does not include timing data, so any startup-speed improvement is inferred from the reduced request count rather than directly measured.",
    "The patch excerpt for `on_mcp_startup_complete` is truncated, so the exact sequencing of the new loading path is only partially visible in the bundle."
  ],
  "confidence": "likely",
  "config_flags": [],
  "impact": "low",
  "kind": "behavior_change",
  "lane": "github",
  "proof_points": [
    "The PR title is `[apps] Improve app tools loading for TUI`, and the PR body explicitly says the TUI app-tools copy was removed so `tools/list` calls drop from 4 to 1.",
    "The main code change is concentrated in `codex-rs/tui/src/chatwidget.rs`, where the bundle shows new MCP-loading state (`pending_mcp_output_requests`) and removal of the earlier eager connector prefetch path, which fits a consolidated startup flow.",
    "`codex-rs/tui/src/chatwidget/tests.rs` is updated alongside the runtime state change, which supports this as an intentional behavior adjustment in TUI loading rather than a docs-only cleanup."
  ],
  "published_at": "2026-03-22T07:17:48Z",
  "schema": "signal_entry/v1",
  "slug": "tui-app-tool-loading-cuts-mcp-tools-list-calls",
  "source_refs": {
    "commit_urls": [
      "https://github.com/openai/codex/commit/baed7661542915b37f526fcd516433fabbbfcfc7"
    ],
    "items": [
      {
        "kind": "pull_request",
        "meta": "#15376",
        "title": "[apps] Improve app tools loading for TUI.",
        "url": "https://github.com/openai/codex/pull/15376"
      },
      {
        "kind": "commit",
        "meta": "baed766",
        "title": "update",
        "url": "https://github.com/openai/codex/commit/baed7661542915b37f526fcd516433fabbbfcfc7"
      }
    ],
    "pr_url": "https://github.com/openai/codex/pull/15376",
    "repo": "openai/codex"
  },
  "summary": "Merged PR #15376 refactors TUI app-tool loading to reuse the core MCP tool set instead of maintaining a separate TUI-side copy, cutting the startup `tools/list` fan-out from four requests to one.",
  "title": "TUI app-tool startup now avoids repeated MCP `tools/list` calls",
  "watch_state": "Whether users with slower MCP backends report a noticeable improvement in TUI startup or tool availability, since the bundle proves the request reduction but not the end-to-end latency gain.",
  "why_it_matters": "This should reduce duplicate MCP startup work in app-enabled TUI sessions, which can make tool discovery less noisy and lower avoidable load on slower or rate-limited tool servers."
}
