{
  "caveats": [
    "The change is mainly operational: it improves tracing fidelity for websocket-based turns rather than adding a new end-user feature."
  ],
  "confidence": "confirmed",
  "config_flags": [],
  "impact": "low",
  "kind": "behavior_change",
  "lane": "github",
  "proof_points": [
    "The PR description says websocket tracing was previously attached only at connection time and that this change propagates the current tracing context on every `response.create` request.",
    "Bundle evidence in `codex-rs/codex-api/src/common.rs` adds `ws_request_header_traceparent` and `ws_request_header_tracestate` metadata keys plus request-building support for websocket create calls.",
    "The changed core client and websocket test files add `W3cTraceContext`/`current_span_w3c_trace_context` usage and new tracing test support, which indicates the active span context is now wired into runtime websocket traffic and validated in tests."
  ],
  "published_at": "2026-03-19T03:41:07Z",
  "schema": "signal_entry/v1",
  "slug": "websocket-turn-requests-now-propagate-trace-context",
  "source_refs": {
    "commit_urls": [
      "https://github.com/openai/codex/commit/c17855e16bda5ae24b2d1ef8791d2567f59fb311",
      "https://github.com/openai/codex/commit/6cd99318b4350a43f1280d9cb94f21c7a1dcd318",
      "https://github.com/openai/codex/commit/b6671aa1e7c465e3c838377f6363906498a9e6fb",
      "https://github.com/openai/codex/commit/4c5596c9647a49dfc2213482ec7e08c93fd8acde"
    ],
    "items": [
      {
        "kind": "pull_request",
        "meta": "#14632",
        "title": "feat(core, tracing): create turn spans over websockets",
        "url": "https://github.com/openai/codex/pull/14632"
      },
      {
        "kind": "commit",
        "meta": "c17855e",
        "title": "feat(core, tracing): create turn spans over websockets",
        "url": "https://github.com/openai/codex/commit/c17855e16bda5ae24b2d1ef8791d2567f59fb311"
      },
      {
        "kind": "commit",
        "meta": "b6671aa",
        "title": "clean up",
        "url": "https://github.com/openai/codex/commit/b6671aa1e7c465e3c838377f6363906498a9e6fb"
      }
    ],
    "pr_url": "https://github.com/openai/codex/pull/14632",
    "repo": "openai/codex"
  },
  "summary": "Merged PR #14632 updates Codex websocket tracing so each `response.create` request carries W3C trace context in `client_metadata`, instead of only attaching tracing metadata when the websocket connection starts.",
  "title": "Websocket turn requests now propagate per-turn trace context",
  "watch_state": "Dependent backend and Responses API work is referenced in the PR body, so real-world end-to-end value depends on those paired changes remaining aligned.",
  "why_it_matters": "This closes an observability gap in persistent websocket sessions. Teams tracing Codex turn execution can now follow individual turns end to end, which makes latency and failure analysis more reliable when a single socket is reused across many requests."
}
