{
  "confidence": "confirmed",
  "config_flags": [],
  "impact": "low",
  "kind": "behavior_change",
  "lane": "github",
  "proof_points": [
    "PR 14867 explicitly states the intent: persist stop-hook continuation prompts as `user` messages rather than hidden `developer` messages to match turn-loop training behavior.",
    "`core/src/event_mapping.rs` now parses user-role items via `parse_visible_hook_prompt_message` into `TurnItem::HookPrompt`, and `core/src/compact_remote.rs` preserves `TurnItem::HookPrompt` during compaction filtering.",
    "Protocol/model updates add a new `hookPrompt`/`HookPromptFragment` surface (`HookRunId` + `text`) across Rust and generated TypeScript schema (`app-server-protocol` and `protocol/src/items.rs`), making continuation prompts a first-class event payload.",
    "Hook execution now stores continuation data as `continuation_fragments: Vec<HookPromptFragment>` (`hooks/src/events/stop.rs`) with tests added for hook prompt fragment parsing/escaping and multi stop-hook continuation behavior in core hook and contextual user message tests."
  ],
  "published_at": "2026-03-19T17:53:09Z",
  "schema": "signal_entry/v1",
  "slug": "openai-codex-pr-14867",
  "source_refs": {
    "commit_urls": [
      "https://github.com/openai/codex/commit/9ad2b001f04b4cfb6dcd8f025d16e90d0a5ac99d",
      "https://github.com/openai/codex/commit/e837ce9e02e7dbe88702cdce33d727c089c0d246",
      "https://github.com/openai/codex/commit/94d66dc4212c9cb4ff4a58008908d6c5a235b579",
      "https://github.com/openai/codex/commit/7b8c000a7305690d6d97e74f95edcac98333a5da",
      "https://github.com/openai/codex/commit/796438281e8661db8ea2bacc969500f85692b960",
      "https://github.com/openai/codex/commit/ae25f38428b2f9ed3972bfdf98205903eae91e9c",
      "https://github.com/openai/codex/commit/8824ebaab11b685d1e2442cc57eb04c07ac95044",
      "https://github.com/openai/codex/commit/8e59ce15d7f98aa146aa460f609627e065519ac0",
      "https://github.com/openai/codex/commit/f664f40d73dfbf8bd696d46db27e538b702656f9",
      "https://github.com/openai/codex/commit/3c358c72af9c8b4ba8ab57cc3fbff9850915beb7",
      "https://github.com/openai/codex/commit/30dc1b0391338f77f7e34775599d8cb199d0825c",
      "https://github.com/openai/codex/commit/7f63b99841ec26e93d854a813cd017198dc16950",
      "https://github.com/openai/codex/commit/2518b8f728262fcb66eb8176fb569d1487d43559",
      "https://github.com/openai/codex/commit/4034f28b8c45632cc2d53b25bedc0e45bf27fd5d"
    ],
    "items": [
      {
        "kind": "pull_request",
        "meta": "#14867",
        "title": "[hooks] use a user message > developer message for prompt continuation",
        "url": "https://github.com/openai/codex/pull/14867"
      },
      {
        "kind": "commit",
        "meta": "9ad2b00",
        "title": "use a user message > developer message for prompt continuation",
        "url": "https://github.com/openai/codex/commit/9ad2b001f04b4cfb6dcd8f025d16e90d0a5ac99d"
      },
      {
        "kind": "commit",
        "meta": "e837ce9",
        "title": "tui_app_server: handle hook prompt items",
        "url": "https://github.com/openai/codex/commit/e837ce9e02e7dbe88702cdce33d727c089c0d246"
      },
      {
        "kind": "commit",
        "meta": "94d66dc",
        "title": "codex: fix CI failure on PR #14867",
        "url": "https://github.com/openai/codex/commit/94d66dc4212c9cb4ff4a58008908d6c5a235b579"
      },
      {
        "kind": "commit",
        "meta": "7b8c000",
        "title": "tui_app_server: fix hook prompt replay build after rebase",
        "url": "https://github.com/openai/codex/commit/7b8c000a7305690d6d97e74f95edcac98333a5da"
      },
      {
        "kind": "commit",
        "meta": "7964382",
        "title": "tui_app_server: remove dead replay helpers",
        "url": "https://github.com/openai/codex/commit/796438281e8661db8ea2bacc969500f85692b960"
      },
      {
        "kind": "commit",
        "meta": "ae25f38",
        "title": "remove unneeded hook_run_ids plural variant",
        "url": "https://github.com/openai/codex/commit/ae25f38428b2f9ed3972bfdf98205903eae91e9c"
      },
      {
        "kind": "commit",
        "meta": "8824eba",
        "title": "use quick-xml instead of hand roll",
        "url": "https://github.com/openai/codex/commit/8824ebaab11b685d1e2442cc57eb04c07ac95044"
      },
      {
        "kind": "commit",
        "meta": "8e59ce1",
        "title": "tests: fix flaky CI expectations",
        "url": "https://github.com/openai/codex/commit/8e59ce15d7f98aa146aa460f609627e065519ac0"
      },
      {
        "kind": "commit",
        "meta": "f664f40",
        "title": "core: fix merge-ref auth telemetry compile",
        "url": "https://github.com/openai/codex/commit/f664f40d73dfbf8bd696d46db27e538b702656f9"
      },
      {
        "kind": "commit",
        "meta": "3c358c7",
        "title": "Merge origin/main into user_message_xml",
        "url": "https://github.com/openai/codex/commit/3c358c72af9c8b4ba8ab57cc3fbff9850915beb7"
      },
      {
        "kind": "commit",
        "meta": "2518b8f",
        "title": "tui_app_server: ignore hook prompt snapshot items",
        "url": "https://github.com/openai/codex/commit/2518b8f728262fcb66eb8176fb569d1487d43559"
      },
      {
        "kind": "commit",
        "meta": "4034f28",
        "title": "app-server-protocol: refresh generated typescript schema",
        "url": "https://github.com/openai/codex/commit/4034f28b8c45632cc2d53b25bedc0e45bf27fd5d"
      }
    ],
    "pr_url": "https://github.com/openai/codex/pull/14867",
    "repo": "openai/codex"
  },
  "summary": "This PR changes stop-hook continuation behavior so hook-provided continuation text is carried as structured user-context messages (`HookPrompt`) instead of being treated like hidden developer instruction content, improving turn-loop handling when hooks run multiple times.",
  "title": "Stop-hook continuation prompts are now persisted as user-visible hook prompts",
  "why_it_matters": "Users are less likely to hit unstable stop-hook replay behavior: continuation prompts from hooks are now part of normal user-visible context and survive history compaction, which helps avoid inconsistent or looping hook-driven turns while keeping prompt continuity aligned with turn-loop expectations."
}
